{
  "$schema": "http://json-schema.org/draft-07/schema#",
  "type": "array",
  "items": {
    "type": "object",
    "properties": {
      "id": { "type": "string" },
      "name": { "type": "string" },
      "age": { "type": "integer" },
      "loyalty_level": { "type": "string" },
      "active": { "type": "boolean" },
      "joined": { "type": "string", "format": "date" },

      "contact": {
        "type": "object",
        "properties": {
          "email": { "type": "string", "format": "email" },
          "phone": { "type": "string" }
        },
        "required": ["email", "phone"]
      },

      "address": {
        "type": "object",
        "properties": {
          "city": { "type": "string" },
          "country": { "type": "string" },
          "postal_code": { "type": "string" }
        },
        "required": ["city", "country", "postal_code"]
      },

      "preferred_store": {
        "type": "object",
        "properties": {
          "brand": { "type": "string" },
          "location": { "type": "string" }
        },
        "required": ["brand", "location"]
      },

      "purchases": {
        "type": "array",
        "items": {
          "type": "object",
          "properties": {
            "date": { "type": "string", "format": "date" },
            "store": { "type": "string" },
            "basket": {
              "type": "array",
              "items": {
                "type": "object",
                "properties": {
                  "product": { "type": "string" },
                  "category": { "type": "string" },
                  "quantity": { "type": "integer" },
                  "price": { "type": "number" }
                },
                "required": ["product", "category", "quantity", "price"]
              }
            }
          },
          "required": ["date", "store", "basket"]
        }
      },

      "lifetime_spend": { "type": "number" }
    },

    "required": [
      "id",
      "name",
      "age",
      "loyalty_level",
      "active",
      "joined",
      "contact",
      "address",
      "preferred_store",
      "purchases",
      "lifetime_spend"
    ]
  }
}